{
  "version": 1,
  "metadata": {
    "name": "Volkswagen Golf (Hatchback/Variant)",
    "brand": "Volkswagen",
    "model": "Golf",
    "years": "2019-2024",
    "source": "Internal measurements / placeholder",
    "measured_by": "Tunexa",
    "measured_at": "2025-01-01",
    "notes": "Compact car acoustics with Beats Audio system characteristics."
  },
  "cabin": {
    "type": "hatchback",
    "volume_l": 2400
  },
  "nvh": {
    "idle_dBA": 35,
    "speed_100kmh_dBA": 65,
    "noise_profile": ["road", "wind", "engine"]
  },
  "rt60_ms": {
    "125": 210,
    "250": 190,
    "500": 170,
    "1000": 155,
    "2000": 145,
    "4000": 135
  },
  "resonance_modes": [
    {"freq_Hz": 70, "q": 6.5},
    {"freq_Hz": 140, "q": 5.8}
  ],
  "target_curve": "Harman OE 2019",
  "mic_positions": [
    {"name": "driver_ear", "x": 0.40, "y": 0.18, "z": 0.88},
    {"name": "passenger_ear", "x": -0.40, "y": 0.18, "z": 0.88}
  ],
  "ir_assets": [
    {"channel": "driver_L", "url": "assets/ir/volkswagen/golf/driver_L.wav"},
    {"channel": "driver_R", "url": "assets/ir/volkswagen/golf/driver_R.wav"}
  ],
  "measured_fr_bands": {
    "31.5": -2.5,
    "63": -1.0,
    "125": 1.5,
    "250": 2.5,
    "500": 1.0,
    "1000": 0.0,
    "2000": -0.8,
    "4000": -1.2,
    "8000": -1.8
  },
  "recommended_tuning": {
    "eq": [
      {"type": "peaking", "f_Hz": 70, "q": 1.1, "gain_dB": 2.0},
      {"type": "peaking", "f_Hz": 280, "q": 1.0, "gain_dB": -1.8},
      {"type": "shelf_high", "f_Hz": 5500, "q": 0.8, "gain_dB": 2.0}
    ],
    "time_alignment_ms": {
      "FL": 0.00,
      "FR": 0.08,
      "RL": 0.78,
      "RR": 0.82,
      "SUB": 2.10
    },
    "crossovers": {
      "SUB": {"type": "LPF", "f_Hz": 85, "slope_dB_oct": 24},
      "Mains": {"type": "HPF", "f_Hz": 85, "slope_dB_oct": 18}
    }
  }
}