{
  "version": 1,
  "metadata": {
    "name": "Tesla Model 3 (Sedan)",
    "brand": "Tesla",
    "model": "Model 3",
    "years": "2021-2024",
    "source": "Internal measurements / placeholder",
    "measured_by": "Tunexa",
    "measured_at": "2025-01-01",
    "notes": "Electric vehicle acoustics with Tesla Premium Audio system characteristics. Minimal road noise due to EV nature."
  },
  "cabin": {
    "type": "sedan",
    "volume_l": 2900
  },
  "nvh": {
    "idle_dBA": 28,
    "speed_100kmh_dBA": 58,
    "noise_profile": ["road", "wind", "hvac"]
  },
  "rt60_ms": {
    "125": 185,
    "250": 170,
    "500": 155,
    "1000": 140,
    "2000": 130,
    "4000": 120
  },
  "resonance_modes": [
    {"freq_Hz": 62, "q": 7.5},
    {"freq_Hz": 124, "q": 6.8}
  ],
  "target_curve": "Tesla Premium 2022",
  "mic_positions": [
    {"name": "driver_ear", "x": 0.44, "y": 0.20, "z": 0.90},
    {"name": "passenger_ear", "x": -0.44, "y": 0.20, "z": 0.90},
    {"name": "rear_left", "x": 0.44, "y": -0.72, "z": 0.86},
    {"name": "rear_right", "x": -0.44, "y": -0.72, "z": 0.86}
  ],
  "ir_assets": [
    {"channel": "driver_L", "url": "assets/ir/tesla/model-3/driver_L.wav"},
    {"channel": "driver_R", "url": "assets/ir/tesla/model-3/driver_R.wav"},
    {"channel": "rear_L", "url": "assets/ir/tesla/model-3/rear_L.wav"},
    {"channel": "rear_R", "url": "assets/ir/tesla/model-3/rear_R.wav"}
  ],
  "measured_fr_bands": {
    "31.5": -2.8,
    "63": -1.2,
    "125": 0.8,
    "250": 1.5,
    "500": 1.0,
    "1000": 0.0,
    "2000": -0.5,
    "4000": -1.2,
    "8000": -2.2
  },
  "recommended_tuning": {
    "eq": [
      {"type": "peaking", "f_Hz": 62, "q": 1.2, "gain_dB": 2.2},
      {"type": "peaking", "f_Hz": 250, "q": 1.0, "gain_dB": -1.5},
      {"type": "peaking", "f_Hz": 4000, "q": 1.5, "gain_dB": 1.2},
      {"type": "shelf_high", "f_Hz": 8000, "q": 0.8, "gain_dB": 2.0}
    ],
    "time_alignment_ms": {
      "FL": 0.00,
      "FR": 0.10,
      "RL": 0.88,
      "RR": 0.95,
      "SUB": 2.20
    },
    "crossovers": {
      "SUB": {"type": "LPF", "f_Hz": 80, "slope_dB_oct": 24},
      "Mains": {"type": "HPF", "f_Hz": 80, "slope_dB_oct": 18}
    }
  }
}